{
  "$schema": "https://json-schema.org/draft/2020-12/schema",
  "$id": "https://deterministicagents.ai/gate/v1/contracts/abom.schema.json",
  "title": "GATE Agent Bill of Materials (ABOM)",
  "description": "Authoritative manifest for an agent version: model, prompt bundle, tool schema set, invariant bundle, policy bundle. v1.3 adds current_baseline_hash so the C19 baseline is tied to the ABOM version. v1.4 adds output_classification_bundle_hash so the C20 bundle in force for this agent is recorded, and auto_enrolment_eligible so the C17 fast-path eligibility is an ABOM property rather than a per-deployment policy lookup.",
  "version": "1.2.0",
  "type": "object",

  "required": [
    "schema_version", "abom_id", "abom_hash",
    "agent_name", "agent_version",
    "model", "prompt_bundle_hash",
    "tool_schema_hash",
    "policy_bundle_hash",
    "invariant_bundle_hash",
    "created_at", "owner_identity"
  ],

  "properties": {
    "schema_version": { "type": "string", "const": "v1" },

    "abom_id":   { "type": "string", "format": "uuid" },
    "abom_hash": {
      "type": "string", "pattern": "^sha256:[a-f0-9]{64}$",
      "description": "Stable hash over the canonicalised ABOM contents. Recorded in policy decisions, replay traces, and C19 baselines."
    },

    "agent_name":    { "type": "string" },
    "agent_version": { "type": "string" },

    "model": {
      "type": "object",
      "required": ["provider", "name", "version"],
      "properties": {
        "provider":  { "type": "string" },
        "name":      { "type": "string" },
        "version":   { "type": "string" },
        "config":    { "type": "object", "description": "Temperature, top_p, max_tokens, seed, etc. Pinned for replay." }
      }
    },

    "prompt_bundle_hash":    { "type": "string", "pattern": "^sha256:[a-f0-9]{64}$" },
    "tool_schema_hash":      { "type": "string", "pattern": "^sha256:[a-f0-9]{64}$" },
    "policy_bundle_hash":    { "type": "string", "pattern": "^sha256:[a-f0-9]{64}$" },
    "invariant_bundle_hash": { "type": "string", "pattern": "^sha256:[a-f0-9]{64}$" },

    "current_baseline_hash": {
      "type": "string", "pattern": "^sha256:[a-f0-9]{64}$",
      "description": "Hash of the active C19 behavioural baseline for this ABOM. Required at bounded and high-privilege tiers per Check18. Updates trigger the C19 re-baselining workflow."
    },

    "memory_quality_bundle_hash": {
      "type": "string", "pattern": "^sha256:[a-f0-9]{64}$",
      "description": "Hash of the active C18 quality bundle in force for this agent. Recorded in every quality_decision event."
    },

    "output_classification_bundle_hash": {
      "type": "string", "pattern": "^sha256:[a-f0-9]{64}$",
      "description": "Hash of the active C20 output classification bundle for this agent. Recorded in every gate.output.classification event via bundle_hash. Required at bounded and high-privilege tiers per Check20; presence enforcement is at the conformance layer, not the schema."
    },

    "auto_enrolment_eligible": {
      "type": "boolean",
      "default": false,
      "description": "True when this agent's manifest declares eligibility for the C17 automated enrolment fast-path. Default false (matching the precedent set by audit_ledger_event.algorithm and behavioural_baseline.algorithm). Consumers treat absence as false. The C17 policy verifies fast-path eligibility on each evaluation regardless of this flag; the flag declares the operator's intent for this ABOM version, not the runtime decision."
    },

    "created_at":     { "type": "string", "format": "date-time" },
    "owner_identity": { "type": "string" },
    "signature":      { "type": "string", "description": "Detached signature over abom_hash." }
  }
}
