{
  "schema_version": "v1",
  "abom_id": "11111111-1111-1111-1111-111111111111",
  "abom_hash": "sha256:5555555555555555555555555555555555555555555555555555555555555555",
  "agent_name": "support-bot",
  "agent_version": "2.1.0",
  "model": {
    "provider": "anthropic",
    "name": "claude-sonnet",
    "version": "2026-01-15",
    "config": {
      "temperature": 0.1,
      "max_tokens": 4096
    }
  },
  "prompt_bundle_hash": "sha256:6666666666666666666666666666666666666666666666666666666666666666",
  "tool_schema_hash": "sha256:7777777777777777777777777777777777777777777777777777777777777777",
  "policy_bundle_hash": "sha256:8888888888888888888888888888888888888888888888888888888888888888",
  "invariant_bundle_hash": "sha256:9999999999999999999999999999999999999999999999999999999999999999",
  "current_baseline_hash": "sha256:aaaaaaaaaaaaaaaaaaaaaaaaaaaaaaaaaaaaaaaaaaaaaaaaaaaaaaaaaaaaaaaa",
  "memory_quality_bundle_hash": "sha256:bbbbbbbbbbbbbbbbbbbbbbbbbbbbbbbbbbbbbbbbbbbbbbbbbbbbbbbbbbbbbbbb",
  "created_at": "2026-04-15T00:00:00Z",
  "owner_identity": "team-platform"
}
